### ISSUE TITLE
Cannot see logs from network source

### ISSUE THREAD

**Issue by pinterl** [balabit/syslog-ng-docker#46]
How can I test syslog-ng to make sure everything is set up correctly? I cannot see any files in the /var/log/acquia directory
 
I have attached the  /etc/syslog-ng/syslog-ng.conf file
 
I send a test message from another host with
 
`logger --tcp -n 10.254.239.227 -P 5141 Logging via network $(date)`
 
When I monitor the network traffic on the syslog-ng host with
`tcpdump port 5141 -vv`
 
I get this:
 
```
tcpdump: listening on eth0, link-type EN10MB (Ethernet), capture size 262144 bytes
05:21:39.569382 IP (tos 0x48, ttl 57, id 0, offset 0, flags [DF], proto TCP (6), length 64)
    10.252.34.107.59229 > aws11lvapp999.5141: Flags [SEW], cksum 0xf7bf (correct), seq 2385457101, win 65535, options [mss 1360,nop,wscale 6,nop,nop,TS val 707932918 ecr 0,sackOK,eol], length 0
05:21:39.569493 IP (tos 0x0, ttl 253, id 0, offset 0, flags [DF], proto TCP (6), length 60)
    aws11lvapp999.5141 > 10.252.34.107.59229: Flags [S.E], cksum 0x2877 (incorrect -> 0x9e9d), seq 1988529690, ack 2385457102, win 27960, options [mss 1410,sackOK,TS val 2271834400 ecr 707932918,nop,wscale 7], length 0
05:21:39.667755 IP (tos 0x48, ttl 57, id 0, offset 0, flags [DF], proto TCP (6), length 52)
    10.252.34.107.59229 > aws11lvapp999.5141: Flags [.], cksum 0x3240 (correct), seq 1, ack 1, win 2064, options [nop,nop,TS val 707933014 ecr 2271834400], length 0
05:21:39.667858 IP (tos 0x4a,ECT(0), ttl 57, id 0, offset 0, flags [DF], proto TCP (6), length 126)
    10.252.34.107.59229 > aws11lvapp999.5141: Flags [P.], cksum 0x83f1 (correct), seq 1:75, ack 1, win 2064, options [nop,nop,TS val 707933015 ecr 2271834400], length 74
05:21:39.667887 IP (tos 0x0, ttl 253, id 48346, offset 0, flags [DF], proto TCP (6), length 52)
    aws11lvapp999.5141 > 10.252.34.107.59229: Flags [.], cksum 0x286f (incorrect -> 0x38c8), seq 1, ack 75, win 219, options [nop,nop,TS val 2271834498 ecr 707933015], length 0
05:21:39.671191 IP (tos 0x48, ttl 57, id 0, offset 0, flags [DF], proto TCP (6), length 52)
    10.252.34.107.59229 > aws11lvapp999.5141: Flags [F.], cksum 0x31f4 (correct), seq 75, ack 1, win 2064, options [nop,nop,TS val 707933015 ecr 2271834400], length 0
05:21:39.671275 IP (tos 0x0, ttl 253, id 48347, offset 0, flags [DF], proto TCP (6), length 52)
    aws11lvapp999.5141 > 10.252.34.107.59229: Flags [F.], cksum 0x286f (incorrect -> 0x38c2), seq 1, ack 76, win 219, options [nop,nop,TS val 2271834502 ecr 707933015], length 0
05:21:39.772218 IP (tos 0x48, ttl 57, id 0, offset 0, flags [DF], proto TCP (6), length 52)
    10.252.34.107.59229 > aws11lvapp999.5141: Flags [.], cksum 0x312a (correct), seq 76, ack 2, win 2064, options [nop,nop,TS val 707933114 ecr 2271834502], length 0
^C
8 packets captured
8 packets received by filter
0 packets dropped by kernel
 
```

[syslog-ng.conf.txt](https://github.com/balabit/syslog-ng-docker/files/3312324/syslog-ng.conf.txt)

[docker-compose.yml.txt](https://github.com/balabit/syslog-ng-docker/files/3312325/docker-compose.yml.txt)

**Comment by Kokan** [comment]
You can start syslog-ng in debug (,trace,verbose) mode (`syslog-ng -Fedtv`), that should provide logs about what happens. For example each recieved message a (`Incoming` line), and for writting to the file (`Outgoing` line). Happy hunting :)

Also there is a `syslog-ng-ctl` with that you can verify if you are really useing the correct config (`syslog-ng-ctl config`), and if messages are being processed or not (`syslog-ng-ctl stats`).

**Comment by pinterl** [comment]
Thank you, Péter for the quick response, I will try it and get back to you.
László

**Comment by szemere** [comment]
Hi!
 (Just for the history, the discussion had an another thread on the mailing list.)
 The root cause was a Docker mounting problem, which lead to a conflict between directory and file names. Thus syslog-ng can not create the necessary target files.
